{
  "schema_version": "1.0.0",
  "baseline_commit": "cb845fcfb0b57f7907fd9d129555b6bb558a9ce1",
  "root_mode": "global_home",
  "states": [
    {
      "code": "SC",
      "name": "Santa Catarina",
      "path": "/sc/",
      "published": true
    },
    {
      "code": "RS",
      "name": "Rio Grande do Sul",
      "path": "/rs/",
      "published": true
    },
    {
      "code": "PR",
      "name": "Paraná",
      "path": "/pr/",
      "published": true
    },
    {
      "code": "SP",
      "name": "São Paulo",
      "path": "/sp/",
      "published": true
    }
  ],
  "editions": [
    {
      "edition_id": "2026-sc-federais",
      "legacy_ids": [
        "sc-federais"
      ],
      "election_year": 2026,
      "state": "SC",
      "office": "deputados-federais",
      "office_code": 6,
      "office_label": "Deputados federais",
      "canonical_path": "/sc/deputados-federais/",
      "current_path": "/sc/deputados-federais/",
      "aliases": [],
      "entrypoint": "sc/deputados-federais/index.html",
      "publication_status": "published",
      "research": {
        "status": "partial_documentation",
        "source": "data/global-integration/current-editions.json",
        "release_dependency": null
      },
      "snapshot": {
        "source": "index.html",
        "sha256": "0131074ef3758f72ba592e5c1e19703c013baa95d34363700ead92b8c627ee38",
        "source_ref": "745cb85c9924f58ccb446714a5edf9a90d83d8c9",
        "kind": "published_html",
        "electoral_data": {
          "as_of": null,
          "source": "index.html",
          "source_ref": "cb845fcfb0b57f7907fd9d129555b6bb558a9ce1",
          "limitation": "Electoral date remains in the original HTML sources; not inferred from editorial review dates."
        }
      },
      "capabilities": {
        "A01": {
          "state": "absent",
          "semantic": null,
          "audit_ref": "A01"
        },
        "A02": {
          "state": "partial",
          "semantic": null,
          "audit_ref": "A02"
        },
        "A03": {
          "state": "absent",
          "semantic": null,
          "audit_ref": "A03"
        },
        "A04": {
          "state": "partial",
          "semantic": null,
          "audit_ref": "A04"
        },
        "D01": {
          "state": "ready",
          "semantic": null,
          "audit_ref": "D01"
        },
        "D02": {
          "state": "partial",
          "semantic": null,
          "audit_ref": "D02"
        },
        "D03": {
          "state": "absent",
          "semantic": null,
          "audit_ref": "D03"
        },
        "D04": {
          "state": "absent",
          "semantic": null,
          "audit_ref": "D04"
        },
        "D05": {
          "state": "ready",
          "semantic": null,
          "audit_ref": "D05"
        },
        "D06": {
          "state": "ready",
          "semantic": null,
          "audit_ref": "D06"
        },
        "D07": {
          "state": "ready",
          "semantic": null,
          "audit_ref": "D07"
        },
        "D08": {
          "state": "absent",
          "semantic": null,
          "audit_ref": "D08"
        },
        "D09": {
          "state": "ready",
          "semantic": null,
          "audit_ref": "D09"
        },
        "C01": {
          "state": "partial",
          "semantic": null,
          "audit_ref": "C01"
        },
        "C02": {
          "state": "partial",
          "semantic": null,
          "audit_ref": "C02"
        },
        "C03": {
          "state": "ready",
          "semantic": null,
          "audit_ref": "C03"
        },
        "E01": {
          "state": "ready",
          "semantic": null,
          "audit_ref": "E01"
        },
        "E02": {
          "state": "ready",
          "semantic": null,
          "audit_ref": "E02"
        },
        "E03": {
          "state": "ready",
          "semantic": null,
          "audit_ref": "E03"
        },
        "E04": {
          "state": "partial",
          "semantic": null,
          "audit_ref": "E04"
        },
        "E05": {
          "state": "partial",
          "semantic": null,
          "audit_ref": "E05"
        },
        "E06": {
          "state": "partial",
          "semantic": null,
          "audit_ref": "E06"
        },
        "I01": {
          "state": "ready",
          "semantic": null,
          "audit_ref": "I01"
        },
        "I02": {
          "state": "ready",
          "semantic": null,
          "audit_ref": "I02"
        },
        "I03": {
          "state": "ready",
          "semantic": null,
          "audit_ref": "I03"
        },
        "I04": {
          "state": "ready",
          "semantic": null,
          "audit_ref": "I04"
        },
        "I05": {
          "state": "ready",
          "semantic": null,
          "audit_ref": "I05"
        },
        "Q01": {
          "state": "ready",
          "semantic": null,
          "audit_ref": "Q01"
        },
        "Q02": {
          "state": "partial",
          "semantic": null,
          "audit_ref": "Q02"
        },
        "Q03": {
          "state": "partial",
          "semantic": null,
          "audit_ref": "Q03"
        },
        "Q04": {
          "state": "partial",
          "semantic": null,
          "audit_ref": "Q04"
        },
        "Q05": {
          "state": "ready",
          "semantic": null,
          "audit_ref": "Q05"
        },
        "N01": {
          "state": "edition_specific",
          "semantic": null,
          "audit_ref": "N01"
        },
        "current_support": {
          "state": "ready",
          "semantic": "current_support",
          "audit_ref": "GLOBAL-01"
        },
        "documented_topic": {
          "state": "absent",
          "semantic": "documented_topic",
          "audit_ref": "GLOBAL-01"
        },
        "selected_collection": {
          "state": "ready",
          "semantic": null,
          "audit_ref": "GLOBAL-01"
        },
        "global_shell": {
          "state": "ready",
          "semantic": null,
          "audit_ref": "GLOBAL-01"
        }
      },
      "metadata": {
        "title": "Candidatos a Deputado Federal em SC 2026 | Esquerda em foco",
        "description": "Candidaturas a deputado federal em Santa Catarina nas Eleições 2026, com histórico eleitoral, pautas públicas, redes, sites e fontes verificáveis."
      },
      "migration": {
        "routes_active": true,
        "shell_active": true,
        "template_contract": "global02"
      }
    },
    {
      "edition_id": "2026-sc-estaduais",
      "legacy_ids": [
        "sc-estaduais"
      ],
      "election_year": 2026,
      "state": "SC",
      "office": "deputados-estaduais",
      "office_code": 7,
      "office_label": "Deputados estaduais",
      "canonical_path": "/sc/deputados-estaduais/",
      "current_path": "/sc/deputados-estaduais/",
      "aliases": [
        "/deputados-estaduais/"
      ],
      "entrypoint": "sc/deputados-estaduais/index.html",
      "publication_status": "published",
      "research": {
        "status": "partial_documentation",
        "source": "data/global-integration/current-editions.json",
        "release_dependency": "Manter pendências editoriais da issue #4 separadas da migração de UX."
      },
      "snapshot": {
        "source": "deputados-estaduais/index.html",
        "sha256": "1597bd250ab469e8be72fb687b54559c42dae658b0b92e6f73d0c9a28df8c93e",
        "source_ref": "745cb85c9924f58ccb446714a5edf9a90d83d8c9",
        "kind": "published_html",
        "electoral_data": {
          "as_of": "2026-09-21T17:10:53.276098+00:00",
          "source": "deputados-estaduais/data/candidaturas.json",
          "locator": "collected_at",
          "source_ref": "cb845fcfb0b57f7907fd9d129555b6bb558a9ce1",
          "sha256": "ecf662ab0b0fe8df80233a55924ccd2144371ce0455ead18bff639adf57bf122",
          "source_dates": {
            "collected_at": "2026-09-21T17:10:53.276098+00:00",
            "updated_at": "2026-09-21"
          },
          "limitation": "Copied snapshot, not a new collection; individual supplemental dates remain in the source."
        }
      },
      "capabilities": {
        "A01": {
          "state": "absent",
          "semantic": null,
          "audit_ref": "A01"
        },
        "A02": {
          "state": "absent",
          "semantic": null,
          "audit_ref": "A02"
        },
        "A03": {
          "state": "absent",
          "semantic": null,
          "audit_ref": "A03"
        },
        "A04": {
          "state": "partial",
          "semantic": null,
          "audit_ref": "A04"
        },
        "D01": {
          "state": "ready",
          "semantic": null,
          "audit_ref": "D01"
        },
        "D02": {
          "state": "ready",
          "semantic": null,
          "audit_ref": "D02"
        },
        "D03": {
          "state": "ready",
          "semantic": null,
          "audit_ref": "D03"
        },
        "D04": {
          "state": "absent",
          "semantic": null,
          "audit_ref": "D04"
        },
        "D05": {
          "state": "absent",
          "semantic": null,
          "audit_ref": "D05"
        },
        "D06": {
          "state": "partial",
          "semantic": null,
          "audit_ref": "D06"
        },
        "D07": {
          "state": "absent",
          "semantic": null,
          "audit_ref": "D07"
        },
        "D08": {
          "state": "absent",
          "semantic": null,
          "audit_ref": "D08"
        },
        "D09": {
          "state": "ready",
          "semantic": null,
          "audit_ref": "D09"
        },
        "C01": {
          "state": "ready",
          "semantic": null,
          "audit_ref": "C01"
        },
        "C02": {
          "state": "ready",
          "semantic": null,
          "audit_ref": "C02"
        },
        "C03": {
          "state": "partial",
          "semantic": null,